{
  "dataset_id": "dam-sen-synthetic-search-v1",
  "version": "1.1.0",
  "source_fixture": "../geojson/pois.geojson",
  "scope": "Synthetic software-test POIs only; not real Dam Sen park data.",
  "queries": [
    {"id":"q001","locale":"vi","text":"Vườn Cầu Vồng","case_type":"exact","relevant":[{"poi_id":"00000000-0000-4000-8000-000000000101","grade":3}]},
    {"id":"q002","locale":"en","text":"Rainbow Garden","case_type":"exact","relevant":[{"poi_id":"00000000-0000-4000-8000-000000000101","grade":3}]},
    {"id":"q003","locale":"vi","text":"Trạm Khám Phá Nước","case_type":"exact","relevant":[{"poi_id":"00000000-0000-4000-8000-000000000102","grade":3}]},
    {"id":"q004","locale":"en","text":"Water Discovery Station","case_type":"exact","relevant":[{"poi_id":"00000000-0000-4000-8000-000000000102","grade":3}]},
    {"id":"q005","locale":"vi","text":"Sân Khấu Gió","case_type":"exact","relevant":[{"poi_id":"00000000-0000-4000-8000-000000000103","grade":3}]},
    {"id":"q006","locale":"en","text":"Wind Stage","case_type":"exact","relevant":[{"poi_id":"00000000-0000-4000-8000-000000000103","grade":3}]},
    {"id":"q007","locale":"vi","text":"Nhà Khám Phá Xanh","case_type":"exact","relevant":[{"poi_id":"00000000-0000-4000-8000-000000000104","grade":3}]},
    {"id":"q008","locale":"en","text":"Green Discovery House","case_type":"exact","relevant":[{"poi_id":"00000000-0000-4000-8000-000000000104","grade":3}]},
    {"id":"q009","locale":"vi","text":"Quảng Trường Mây","case_type":"exact","relevant":[{"poi_id":"00000000-0000-4000-8000-000000000105","grade":3}]},
    {"id":"q010","locale":"en","text":"Cloud Square","case_type":"exact","relevant":[{"poi_id":"00000000-0000-4000-8000-000000000105","grade":3}]},

    {"id":"q011","locale":"vi","text":"vuon cau vong","case_type":"no_diacritic","relevant":[{"poi_id":"00000000-0000-4000-8000-000000000101","grade":3}]},
    {"id":"q012","locale":"vi","text":"tram kham pha nuoc","case_type":"no_diacritic","relevant":[{"poi_id":"00000000-0000-4000-8000-000000000102","grade":3}]},
    {"id":"q013","locale":"vi","text":"san khau gio","case_type":"no_diacritic","relevant":[{"poi_id":"00000000-0000-4000-8000-000000000103","grade":3}]},
    {"id":"q014","locale":"vi","text":"nha kham pha xanh","case_type":"no_diacritic","relevant":[{"poi_id":"00000000-0000-4000-8000-000000000104","grade":3}]},
    {"id":"q015","locale":"vi","text":"quang truong may","case_type":"no_diacritic","relevant":[{"poi_id":"00000000-0000-4000-8000-000000000105","grade":3}]},
    {"id":"q016","locale":"vi","text":"khu vuon gia lap nhieu mau","case_type":"no_diacritic","relevant":[{"poi_id":"00000000-0000-4000-8000-000000000101","grade":3}]},
    {"id":"q017","locale":"vi","text":"diem trung bay vong tuan hoan nuoc","case_type":"no_diacritic","relevant":[{"poi_id":"00000000-0000-4000-8000-000000000102","grade":3}]},
    {"id":"q018","locale":"vi","text":"khong gian trong nha cho gia dinh","case_type":"no_diacritic","relevant":[{"poi_id":"00000000-0000-4000-8000-000000000104","grade":3}]},

    {"id":"q019","locale":"vi","text":"khu vườn nhiều màu cho gia đình","case_type":"semantic_intent","relevant":[{"poi_id":"00000000-0000-4000-8000-000000000101","grade":3}]},
    {"id":"q020","locale":"vi","text":"nơi tìm hiểu vòng tuần hoàn của nước","case_type":"semantic_intent","relevant":[{"poi_id":"00000000-0000-4000-8000-000000000102","grade":3}]},
    {"id":"q021","locale":"vi","text":"tôi muốn xem biểu diễn âm nhạc","case_type":"semantic_intent","relevant":[{"poi_id":"00000000-0000-4000-8000-000000000103","grade":3}]},
    {"id":"q022","locale":"vi","text":"chỗ trong nhà dành cho cả gia đình","case_type":"semantic_intent","relevant":[{"poi_id":"00000000-0000-4000-8000-000000000104","grade":3}]},
    {"id":"q023","locale":"vi","text":"mốc hẹn gặp nhau","case_type":"semantic_intent","relevant":[{"poi_id":"00000000-0000-4000-8000-000000000105","grade":3}]},
    {"id":"q024","locale":"en","text":"colourful fictional family garden","case_type":"semantic_intent","relevant":[{"poi_id":"00000000-0000-4000-8000-000000000101","grade":3}]},
    {"id":"q025","locale":"en","text":"learn how the water cycle works","case_type":"semantic_intent","relevant":[{"poi_id":"00000000-0000-4000-8000-000000000102","grade":3}]},
    {"id":"q026","locale":"en","text":"place for a music performance","case_type":"semantic_intent","relevant":[{"poi_id":"00000000-0000-4000-8000-000000000103","grade":3}]},
    {"id":"q027","locale":"en","text":"indoor family discovery space","case_type":"semantic_intent","relevant":[{"poi_id":"00000000-0000-4000-8000-000000000104","grade":3}]},
    {"id":"q028","locale":"en","text":"fictional meeting point landmark","case_type":"semantic_intent","relevant":[{"poi_id":"00000000-0000-4000-8000-000000000105","grade":3}]},

    {"id":"q029","locale":"vi","text":"Vườn Cầu Vồgn","case_type":"typo","relevant":[{"poi_id":"00000000-0000-4000-8000-000000000101","grade":3}]},
    {"id":"q030","locale":"vi","text":"Trạm Khám Phá Nưóc","case_type":"typo","relevant":[{"poi_id":"00000000-0000-4000-8000-000000000102","grade":3}]},
    {"id":"q031","locale":"vi","text":"Sân Kấhu Gió","case_type":"typo","relevant":[{"poi_id":"00000000-0000-4000-8000-000000000103","grade":3}]},
    {"id":"q032","locale":"vi","text":"Nhà Khám Phá Xnah","case_type":"typo","relevant":[{"poi_id":"00000000-0000-4000-8000-000000000104","grade":3}]},
    {"id":"q033","locale":"vi","text":"Quảng Trưòng Mây","case_type":"typo","relevant":[{"poi_id":"00000000-0000-4000-8000-000000000105","grade":3}]},
    {"id":"q034","locale":"en","text":"Rainbow Garedn","case_type":"typo","relevant":[{"poi_id":"00000000-0000-4000-8000-000000000101","grade":3}]},
    {"id":"q035","locale":"en","text":"Water Discovery Statoin","case_type":"typo","relevant":[{"poi_id":"00000000-0000-4000-8000-000000000102","grade":3}]},
    {"id":"q036","locale":"en","text":"Green Discovery Hosue","case_type":"typo","relevant":[{"poi_id":"00000000-0000-4000-8000-000000000104","grade":3}]},

    {"id":"q037","locale":"en","text":"garden category","case_type":"category_location","relevant":[{"poi_id":"00000000-0000-4000-8000-000000000101","grade":3}]},
    {"id":"q038","locale":"en","text":"exhibit category","case_type":"category_location","relevant":[{"poi_id":"00000000-0000-4000-8000-000000000102","grade":3}]},
    {"id":"q039","locale":"en","text":"show category","case_type":"category_location","relevant":[{"poi_id":"00000000-0000-4000-8000-000000000103","grade":3}]},
    {"id":"q040","locale":"en","text":"indoor category","case_type":"category_location","relevant":[{"poi_id":"00000000-0000-4000-8000-000000000104","grade":3}]},
    {"id":"q041","locale":"en","text":"landmark category","case_type":"category_location","relevant":[{"poi_id":"00000000-0000-4000-8000-000000000105","grade":3}]},
    {"id":"q042","locale":"en","text":"westernmost synthetic POI","case_type":"category_location","relevant":[{"poi_id":"00000000-0000-4000-8000-000000000101","grade":3}]},
    {"id":"q043","locale":"vi","text":"các POI giả lập ở xa nhất về phía đông","case_type":"category_location","relevant":[{"poi_id":"00000000-0000-4000-8000-000000000103","grade":3},{"poi_id":"00000000-0000-4000-8000-000000000105","grade":3}]},
    {"id":"q044","locale":"en","text":"northernmost fixture POIs","case_type":"category_location","relevant":[{"poi_id":"00000000-0000-4000-8000-000000000104","grade":3},{"poi_id":"00000000-0000-4000-8000-000000000105","grade":3}]},
    {"id":"q045","locale":"vi","text":"điểm chính giữa hàng phía bắc","case_type":"category_location","relevant":[{"poi_id":"00000000-0000-4000-8000-000000000104","grade":3}]},

    {"id":"q046","locale":"vi","text":"tàu lượn siêu tốc","case_type":"zero_result","relevant":[]},
    {"id":"q047","locale":"en","text":"zoo","case_type":"zero_result","relevant":[]},
    {"id":"q048","locale":"vi","text":"nhà hàng pizza","case_type":"zero_result","relevant":[]},
    {"id":"q049","locale":"en","text":"car parking","case_type":"zero_result","relevant":[]},
    {"id":"q050","locale":"vi","text":"nhà vệ sinh","case_type":"zero_result","relevant":[]}
  ]
}
